{"approvedInputSha256":"20a78b9f40ff2393037c9a160c957783cf590b4f01797493d22fcd2039e9cbff","check":{"id":"pcap-1.23b-products-v1","version":1},"publicRepositoryCommit":"ec0529193bf766709d53da0be6a4c4bb760bb20e","result":{"status":"pass"},"schemaVersion":1,"toolVersions":{"python":"3.12","verifier":"1.0"}}
